{
  "$schema":"https://json-schema.org/draft/2020-12/schema",
  "$id":"https://proper.local/schemas/proper_v2_3/appworld_controlled_install_static_inventory_protocol_validation.schema.json",
  "type":"object",
  "additionalProperties":false,
  "required":["schema_version","run_kind","checks","passed","config_sha256","scripted_trace_count","apps_bundle_decrypted","tests_bundle_decrypted","data_downloaded","source_extracted","api_inventory_performed","task_instruction_read","ground_truth_or_evaluator_read","model_loaded","gpu_used","bundle_inventory_implementation_authorized","protected_bundle_decryption_authorized","source_install_authorized","static_api_inventory_authorized","model_run_authorized","confirmatory_claim_authorized","next_gate"],
  "properties": {
    "schema_version":{"const":1},
    "run_kind":{"const":"proper_v2_3_appworld_controlled_install_static_inventory_protocol_validation"},
    "checks":{"type":"object","minProperties":1,"additionalProperties":{"type":"boolean"}},
    "passed":{"type":"boolean"},
    "config_sha256":{"type":"string","pattern":"^[0-9a-f]{64}$"},
    "scripted_trace_count":{"const":6},
    "apps_bundle_decrypted":{"const":false},
    "tests_bundle_decrypted":{"const":false},
    "data_downloaded":{"const":false},
    "source_extracted":{"const":false},
    "api_inventory_performed":{"const":false},
    "task_instruction_read":{"const":false},
    "ground_truth_or_evaluator_read":{"const":false},
    "model_loaded":{"const":false},
    "gpu_used":{"const":false},
    "bundle_inventory_implementation_authorized":{"type":"boolean"},
    "protected_bundle_decryption_authorized":{"const":false},
    "source_install_authorized":{"const":false},
    "static_api_inventory_authorized":{"const":false},
    "model_run_authorized":{"const":false},
    "confirmatory_claim_authorized":{"const":false},
    "next_gate":{"const":"implement_and_synthetically_validate_aggregate_only_apps_bundle_inventory"}
  }
}
