{
  "api_inventory_performed": false,
  "apps_bundle_decrypted": false,
  "bundle_inventory_implementation_authorized": true,
  "checks": {
    "aggregate_and_hashed_evidence_preserved": true,
    "all_execution_and_claim_boundaries_closed": true,
    "all_zip_members_validated_before_extraction": true,
    "exact_apps_bundle_identity_frozen": true,
    "five_protocol_tests_pass": true,
    "future_static_inventory_is_gold_free_and_single_action": true,
    "independent_zero_network_model_and_extraction_budgets": true,
    "official_overbroad_and_destructive_commands_forbidden": true,
    "protected_plaintext_never_persisted": true,
    "public_crypto_contract_is_exact_and_in_memory": true,
    "six_scripted_traces_stop_closed": true,
    "tests_and_data_bundles_forbidden": true,
    "validation_schema_is_closed": true,
    "wheel_inventory_freeze_hashes_match": true
  },
  "config_sha256": "16ad21c162f3a17d7b6669bfa08aebe6e0972f3c80bb878b5828c0fd7f2e22ea",
  "confirmatory_claim_authorized": false,
  "data_downloaded": false,
  "gpu_used": false,
  "ground_truth_or_evaluator_read": false,
  "model_loaded": false,
  "model_run_authorized": false,
  "next_gate": "implement_and_synthetically_validate_aggregate_only_apps_bundle_inventory",
  "passed": true,
  "protected_bundle_decryption_authorized": false,
  "run_kind": "proper_v2_3_appworld_controlled_install_static_inventory_protocol_validation",
  "schema_version": 1,
  "scripted_trace_count": 6,
  "source_extracted": false,
  "source_install_authorized": false,
  "static_api_inventory_authorized": false,
  "task_instruction_read": false,
  "tests_bundle_decrypted": false
}
